{
  "schema_version": "1.0.0",
  "question_id": "ableitung_kettenregel_exp_001",
  "status": "published",
  "language": "de",
  "topic": "Ableitungen",
  "subtopic": "Kettenregel bei Exponentialfunktionen",
  "difficulty": "medium",
  "target_group": "Studierende der Ingenieurwissenschaften im mathematischen Grundlagenmodul",
  "question_text": "Differenzieren Sie die Funktion f einmal nach x.",
  "question_text_template": "Gegeben ist die Funktion {funktion}. Differenzieren Sie f einmal nach x.",
  "question_latex": "Differenzieren Sie die Funktion \\( f \\) einmal nach \\( x \\).",
  "given_data": {
    "variable": "x"
  },
  "learning_goals": [
    "Die Kettenregel auf eine Exponentialfunktion anwenden.",
    "Den inneren Exponenten, also die innere Funktion der Verkettung, korrekt ableiten.",
    "Den konstanten Faktor vor der Exponentialfunktion bei der Ableitung berücksichtigen."
  ],
  "prerequisites": [
    "Ableitung von e^x",
    "Potenzregel",
    "Kettenregel",
    "Konstantenfaktorregel"
  ],
  "student_inputs": [
    {
      "name": "ans1",
      "type": "algebraic_expression",
      "description": "Ableitung der gegebenen Funktion.",
      "variable": "x",
      "syntax_examples": [
        "-5*exp(x^2-2*exp(x))*(2*x-2*exp(x))",
        "10*(exp(x)-x)*exp(x^2-2*exp(x))"
      ]
    }
  ],
  "model_solution": {
    "final_answer": "-5*exp(x^2-2*exp(x))*(2*x-2*exp(x))",
    "final_answer_latex": "-5e^{x^2-2e^x}(2x-2e^x)",
    "solution_steps": [
      {
        "step_id": "identify_outer_inner",
        "description": "Die Funktion besteht aus einem konstanten Faktor -5 und einer äußeren Exponentialfunktion.",
        "formula": "f=-5*exp(g(x))",
        "formula_latex": "f(x)=-5e^{g(x)}"
      },
      {
        "step_id": "identify_inner_function",
        "description": "Die innere Funktion ist der Exponent.",
        "formula": "g(x)=x^2-2*exp(x)",
        "formula_latex": "g(x)=x^2-2e^x"
      },
      {
        "step_id": "differentiate_inner_function",
        "description": "Die innere Funktion wird abgeleitet.",
        "formula": "g'(x)=2*x-2*exp(x)",
        "formula_latex": "g'(x)=2x-2e^x"
      },
      {
        "step_id": "apply_chain_rule",
        "description": "Nach der Kettenregel wird die äußere Ableitung mit der inneren Ableitung multipliziert.",
        "formula": "f'(x)=-5*exp(g(x))*g'(x)",
        "formula_latex": "f'(x)=-5e^{g(x)}g'(x)"
      },
      {
        "step_id": "combine",
        "description": "Die Terme werden zusammengesetzt.",
        "formula": "-5*exp(x^2-2*exp(x))*(2*x-2*exp(x))",
        "formula_latex": "-5e^{x^2-2e^x}(2x-2e^x)"
      }
    ],
    "equivalent_forms": [
      "10*(exp(x)-x)*exp(x^2-2*exp(x))",
      "-10*(x-exp(x))*exp(x^2-2*exp(x))"
    ]
  },
  "evaluation_examples": {
    "instance_id": "task-chain-exp-f1",
    "function": "f(x)=-5*exp(x^2-2*exp(x))",
    "answers": [
      {
        "case_id": "task-chain-exp-missing-inner-001",
        "student_answer": "-5*exp(x^2-2*exp(x))",
        "expected_error": "missing_chain_rule_inner_derivative",
        "expected_input_validity": "valid",
        "expected_correctness": "incorrect"
      },
      {
        "case_id": "task-chain-exp-wrong-inner-exp-001",
        "student_answer": "-5*exp(x^2-2*exp(x))*(2*x-2)",
        "expected_error": "wrong_derivative_inner_exp",
        "expected_input_validity": "valid",
        "expected_correctness": "incorrect"
      },
      {
        "case_id": "task-chain-exp-wrong-power-001",
        "student_answer": "-5*exp(x^2-2*exp(x))*(x-2*exp(x))",
        "expected_error": "wrong_derivative_power",
        "expected_input_validity": "valid",
        "expected_correctness": "incorrect"
      },
      {
        "case_id": "task-chain-exp-missing-constant-001",
        "student_answer": "exp(x^2-2*exp(x))*(2*x-2*exp(x))",
        "expected_error": "missing_constant_factor",
        "expected_input_validity": "valid",
        "expected_correctness": "incorrect"
      },
      {
        "case_id": "task-chain-exp-sign-error-001",
        "student_answer": "-5*exp(x^2-2*exp(x))*(2*x+2*exp(x))",
        "expected_error": "sign_error",
        "expected_input_validity": "valid",
        "expected_correctness": "incorrect"
      },
      {
        "case_id": "task-chain-exp-only-inner-001",
        "student_answer": "2*x-2*exp(x)",
        "expected_error": "only_inner_derivative",
        "expected_input_validity": "valid",
        "expected_correctness": "incorrect"
      },
      {
        "case_id": "task-chain-exp-syntax-001",
        "student_answer": "-5*exp(x^2-2*exp(x))*(2*x-2*exp(x)",
        "expected_error": "syntax_error",
        "expected_input_validity": "invalid",
        "expected_correctness": "unknown"
      },
      {
        "case_id": "task-chain-exp-unknown-001",
        "student_answer": "42",
        "expected_error": "unknown_error",
        "expected_input_validity": "valid",
        "expected_correctness": "incorrect"
      },
      {
        "case_id": "task-chain-exp-correct-001",
        "student_answer": "10*(exp(x)-x)*exp(x^2-2*exp(x))",
        "expected_error": null,
        "expected_input_validity": "valid",
        "expected_correctness": "correct"
      }
    ]
  },
  "diagnoses": {
    "missing_chain_rule_inner_derivative": {
      "title": "Die innere Ableitung der Kettenregel fehlt.",
      "description": "Die äußere Exponentialfunktion wurde möglicherweise berücksichtigt, aber der Faktor aus der Ableitung des Exponenten fehlt.",
      "severity": "conceptual",
      "feedback_goal": "Darauf hinweisen, dass bei e^(g(x)) zusätzlich mit g'(x) multipliziert werden muss.",
      "concept_tags": [
        "Kettenregel",
        "innere Ableitung",
        "Exponentialfunktion"
      ],
      "avoid_phrases": [
        "Die vollständige Ableitung lautet",
        "Das richtige Ergebnis ist"
      ],
      "preferred_hint_strategy": "compare_with_rule",
      "allowed_hint_levels": [
        1,
        2,
        3
      ]
    },
    "wrong_derivative_inner_exp": {
      "title": "Die Ableitung des inneren Exponenten wurde falsch bestimmt.",
      "description": "Beim Ableiten des inneren Exponenten wurde mindestens ein Term fehlerhaft behandelt.",
      "severity": "procedural",
      "feedback_goal": "Die Ableitung von e^x und die Konstantenfaktorregel aktivieren.",
      "concept_tags": [
        "Ableitung von e^x",
        "Konstantenfaktorregel",
        "innerer Exponent"
      ],
      "avoid_phrases": [
        "Die komplette Lösung ist"
      ],
      "preferred_hint_strategy": "ask_to_check_specific_part",
      "allowed_hint_levels": [
        1,
        2,
        3
      ]
    },
    "wrong_derivative_power": {
      "title": "Die Ableitung des Potenzterms im Exponenten wurde falsch bestimmt.",
      "description": "Beim Ableiten des inneren Exponenten wurde die Potenzregel für den Potenzterm fehlerhaft angewendet.",
      "severity": "procedural",
      "feedback_goal": "Die Potenzregel für den Potenzterm im Exponenten in Erinnerung rufen.",
      "concept_tags": [
        "Potenzregel",
        "Potenzterm",
        "innerer Exponent"
      ],
      "avoid_phrases": [
        "Das Endergebnis lautet"
      ],
      "preferred_hint_strategy": "ask_to_check_specific_part",
      "allowed_hint_levels": [
        1,
        2,
        3
      ]
    },
    "missing_constant_factor": {
      "title": "Der konstante Faktor vor der Exponentialfunktion fehlt.",
      "description": "Die Kettenregel wurde möglicherweise angewendet, aber der Vorfaktor wurde nicht berücksichtigt.",
      "severity": "procedural",
      "feedback_goal": "An die Konstantenfaktorregel erinnern.",
      "concept_tags": [
        "Konstantenfaktorregel",
        "Vorfaktor",
        "konstanter Faktor"
      ],
      "avoid_phrases": [
        "Die vollständige Lösung ist"
      ],
      "preferred_hint_strategy": "ask_to_check_specific_part",
      "allowed_hint_levels": [
        1,
        2
      ]
    },
    "sign_error": {
      "title": "Es liegt vermutlich ein Vorzeichenfehler vor.",
      "description": "Die Struktur der Ableitung ist teilweise erkennbar, aber ein Vorzeichen wurde wahrscheinlich falsch behandelt.",
      "severity": "procedural",
      "feedback_goal": "Zum erneuten Prüfen der Vorzeichen im Exponenten und beim konstanten Faktor anregen.",
      "concept_tags": [
        "Vorzeichen",
        "Kettenregel",
        "innerer Exponent"
      ],
      "avoid_phrases": [
        "Alles ist falsch"
      ],
      "preferred_hint_strategy": "ask_to_check_specific_part",
      "allowed_hint_levels": [
        1,
        2
      ]
    },
    "only_inner_derivative": {
      "title": "Es wurde offenbar nur der innere Exponent abgeleitet.",
      "description": "Die Antwort entspricht vermutlich der Ableitung des Exponenten, aber nicht der Ableitung der gesamten Funktion.",
      "severity": "conceptual",
      "feedback_goal": "Darauf hinweisen, dass der Exponent nur ein Teil der Kettenregel ist.",
      "concept_tags": [
        "Kettenregel",
        "äußere Funktion",
        "innere Funktion"
      ],
      "avoid_phrases": [
        "Das richtige Ergebnis ist"
      ],
      "preferred_hint_strategy": "conceptual_question",
      "allowed_hint_levels": [
        1,
        2,
        3
      ]
    },
    "syntax_error": {
      "title": "Die Eingabe konnte syntaktisch nicht ausgewertet werden.",
      "description": "Die Antwort enthält vermutlich eine ungültige mathematische Schreibweise oder STACK-Syntax.",
      "severity": "syntax",
      "feedback_goal": "Hinweise zur korrekten Eingabesyntax geben.",
      "concept_tags": [
        "Syntax",
        "STACK-Eingabe"
      ],
      "avoid_phrases": [